{
  "version": 2,
  "id": "20260822T051006.598142000Z-b72981df",
  "target": "urn:change-saga:changesaga-codebase:fragment:changesaga-codebase-overview",
  "anchor": {
    "type": "drawing",
    "shapes": [
      {
        "type": "path",
        "points": [
          {
            "x": 0.6877614731237323,
            "y": 0.21691387011797045
          },
          {
            "x": 0.6880942570993914,
            "y": 0.21691387011797045
          },
          {
            "x": 0.6888549061866126,
            "y": 0.21691387011797045
          },
          {
            "x": 0.6906257923427992,
            "y": 0.21691387011797045
          },
          {
            "x": 0.6932801407200812,
            "y": 0.21691387011797045
          },
          {
            "x": 0.6962276559330629,
            "y": 0.21626006948421334
          },
          {
            "x": 0.6992940225659229,
            "y": 0.21496678501889818
          },
          {
            "x": 0.7019562943711968,
            "y": 0.2136782728209827
          },
          {
            "x": 0.7051335889959433,
            "y": 0.2118504944069026
          },
          {
            "x": 0.7090041835699797,
            "y": 0.20927824227847136
          },
          {
            "x": 0.7130649404158215,
            "y": 0.2065150994540526
          },
          {
            "x": 0.717767494929006,
            "y": 0.20367560035123888
          },
          {
            "x": 0.722240270030426,
            "y": 0.20107948688580918
          },
          {
            "x": 0.726839819979716,
            "y": 0.1982590768525942
          },
          {
            "x": 0.7322713298681541,
            "y": 0.19469896537242776
          },
          {
            "x": 0.7378058443204868,
            "y": 0.19086206238307946
          },
          {
            "x": 0.7424965136916836,
            "y": 0.18772191043408545
          },
          {
            "x": 0.7466048111054767,
            "y": 0.18534054900164165
          },
          {
            "x": 0.7507408405172413,
            "y": 0.18292578169740006
          },
          {
            "x": 0.7543618471095335,
            "y": 0.18062077654335126
          },
          {
            "x": 0.7575708354462475,
            "y": 0.17837781086549842
          },
          {
            "x": 0.760744168356998,
            "y": 0.1761157561180468
          },
          {
            "x": 0.7636877218559838,
            "y": 0.1738823349749933
          },
          {
            "x": 0.7664569599391481,
            "y": 0.17163936929714046
          },
          {
            "x": 0.7694718242900609,
            "y": 0.16916733478410262
          },
          {
            "x": 0.7724946120689655,
            "y": 0.16670484480586417
          },
          {
            "x": 0.7752480032961461,
            "y": 0.16450960180200816
          },
          {
            "x": 0.777625031693712,
            "y": 0.16262932844653152
          },
          {
            "x": 0.7797326635395537,
            "y": 0.1610306188676364
          },
          {
            "x": 0.7820661130831643,
            "y": 0.15925533539495285
          },
          {
            "x": 0.7850017431541582,
            "y": 0.15691215210170656
          },
          {
            "x": 0.7882146932048681,
            "y": 0.1539819799182988
          },
          {
            "x": 0.7914751838235294,
            "y": 0.1509134119803001
          },
          {
            "x": 0.7946485167342799,
            "y": 0.14802619020348948
          },
          {
            "x": 0.7977386536511156,
            "y": 0.1452344137746726
          },
          {
            "x": 0.8012843876774848,
            "y": 0.14213243996487612
          },
          {
            "x": 0.8060503296146044,
            "y": 0.1376799144809682
          },
          {
            "x": 0.8130823719574036,
            "y": 0.13075535448402245
          },
          {
            "x": 0.8214613970588235,
            "y": 0.12256614362615965
          },
          {
            "x": 0.8280695360040567,
            "y": 0.11613312717138166
          },
          {
            "x": 0.833707055020284,
            "y": 0.11079773221853167
          },
          {
            "x": 0.8399744865618661,
            "y": 0.10546710953308136
          },
          {
            "x": 0.8458932872718052,
            "y": 0.1008809605619822
          },
          {
            "x": 0.8524538856490872,
            "y": 0.09607051502309777
          },
          {
            "x": 0.8603693902129818,
            "y": 0.08980452792730882
          },
          {
            "x": 0.8685582530425964,
            "y": 0.08225957316840377
          },
          {
            "x": 0.8751743154158215,
            "y": 0.07554499293704425
          },
          {
            "x": 0.8801739984787018,
            "y": 0.0699328064750124
          },
          {
            "x": 0.884484343306288,
            "y": 0.06507941052953078
          },
          {
            "x": 0.8879231110547667,
            "y": 0.06160042759515901
          },
          {
            "x": 0.8907834685598377,
            "y": 0.05881342343374184
          },
          {
            "x": 0.8933625443711968,
            "y": 0.0563795670599015
          },
          {
            "x": 0.8958861561866126,
            "y": 0.05418909632344519
          },
          {
            "x": 0.8979739794624746,
            "y": 0.052132249074180126
          },
          {
            "x": 0.8994239667849898,
            "y": 0.050624212575879055
          },
          {
            "x": 0.9004421272819473,
            "y": 0.04973657083953728
          },
          {
            "x": 0.9011116569472617,
            "y": 0.049230710495170464
          },
          {
            "x": 0.9015276369168357,
            "y": 0.04881075096399801
          },
          {
            "x": 0.9018921146044625,
            "y": 0.048223762073836524
          },
          {
            "x": 0.9047009698275862,
            "y": 0.04496907570725003
          },
          {
            "x": 0.906317349137931,
            "y": 0.043212881304165236
          },
          {
            "x": 0.9075890593306288,
            "y": 0.04198640858244569
          },
          {
            "x": 0.9084883684077079,
            "y": 0.041251479402893906
          },
          {
            "x": 0.9089518889452333,
            "y": 0.04059290650173711
          },
          {
            "x": 0.9092965580628803,
            "y": 0.03994387813537968
          },
          {
            "x": 0.9096927294624746,
            "y": 0.039285305234222884
          },
          {
            "x": 0.9101800202839757,
            "y": 0.038440613904478296
          },
          {
            "x": 0.9107306985294118,
            "y": 0.03760546710953308
          },
          {
            "x": 0.9112694916328601,
            "y": 0.03695643874317566
          },
          {
            "x": 0.9118082847363083,
            "y": 0.0364648952010079
          },
          {
            "x": 0.9127472109533469,
            "y": 0.035744282823655174
          },
          {
            "x": 0.9142051217038539,
            "y": 0.03461802771732906
          },
          {
            "x": 0.9155124873225152,
            "y": 0.03369698010918948
          },
          {
            "x": 0.9164593369675457,
            "y": 0.03300500133623487
          },
          {
            "x": 0.9171605603448276,
            "y": 0.03249436872446837
          },
          {
            "x": 0.9174339186105477,
            "y": 0.03219371587828809
          },
          {
            "x": 0.9175408848884381,
            "y": 0.0320457755888978
          },
          {
            "x": 0.9176636980223124,
            "y": 0.03190737983430687
          },
          {
            "x": 0.9177231237322515,
            "y": 0.03156377658152942
          },
          {
            "x": 0.917754817444219,
            "y": 0.031167678387355402
          },
          {
            "x": 0.917754817444219,
            "y": 0.03071908525178483
          },
          {
            "x": 0.91754880831643,
            "y": 0.030447066010002674
          },
          {
            "x": 0.9169783215010142,
            "y": 0.030447066010002674
          },
          {
            "x": 0.9158175393002028,
            "y": 0.030447066010002674
          },
          {
            "x": 0.913923840010142,
            "y": 0.030556828160195473
          },
          {
            "x": 0.911614160750507,
            "y": 0.030890886878173558
          },
          {
            "x": 0.909177706643002,
            "y": 0.03133948001374413
          },
          {
            "x": 0.9066937119675457,
            "y": 0.03177375634711564
          },
          {
            "x": 0.9033856807809331,
            "y": 0.032456190585270876
          },
          {
            "x": 0.8890680463995944,
            "y": 0.03352040621540106
          },
          {
            "x": 0.8872456579614605,
            "y": 0.03352040621540106
          },
          {
            "x": 0.8856411637931034,
            "y": 0.03352040621540106
          },
          {
            "x": 0.8836365365111561,
            "y": 0.03356812888939793
          },
          {
            "x": 0.8811683886916836,
            "y": 0.033763791852785094
          },
          {
            "x": 0.8786804323022313,
            "y": 0.034102622838162865
          },
          {
            "x": 0.8761290884888439,
            "y": 0.0343841866147444
          },
          {
            "x": 0.8738075240872211,
            "y": 0.034675294926125304
          },
          {
            "x": 0.8719415567951319,
            "y": 0.035076165387699004
          },
          {
            "x": 0.8703806414807302,